id,subreddit,title,num_comments,sentiment_score,pop_score
1ecdb23,technology,Samsung hints at new products as it bets on AI to drive upgrades to its latest foldable phones,0,0.0,0.41011938
1eccf1p,technology,"CNBC's Cramer: Harris Much Better, More \"Sophisticated\" Than Biden On Wall Steet, Big Tech",68,0.4404,0.86064565
1ecc57z,technology,The Messy Reality Behind Trying To Protect The Internet From Terrible Laws,0,-0.4588,0.7684953
1ecah56,technology,OpenAI is taking on Google with a new artificial intelligence search engine | CNN Business,9,0.4767,0.5904561
1eca5zj,technology,Biggest U.S. tech sell-off for over a decade points to wider concerns surrounding high valuations — as Nasdaq 100 loses $1 trillion in market value on Wednesday,16,0.0258,0.8387599
1eca2iu,technology,OpenAI tests new search engine called SearchGPT amid AI arms race,0,0.0,0.0
1ec9s2j,technology,Uncle Sam accuses telco IT pro of decade-long spying campaign for China,1,-0.34,0.7548749
1ec8r2v,technology,Australian scientists genetically engineer common fly species to eat more of humanity’s waste,41,-0.4703,0.9193227
1ec8hai,technology,The Limits of the China Chip Ban,2,-0.5574,0.47685817
1ec7x75,technology,DJI Ban Not Moving Forward—Senate Drops the Countering CCP Drones Act from the 2025 NDAA,30,-0.5574,0.81748813
1ec7r1t,technology,"Looking From Space, Researchers Find Pollution Spiking Near E-Commerce Hubs",1,0.0,0.7684953
1ec7btz,technology,AI models collapse when trained on recursively generated data,24,-0.4939,0.74893165
1ec6tn5,technology,SearchGPT Prototype,1,0.0,0.0
1ec6qot,technology,Sundar Pichai wants real world results for his AI bots—so Google gave bonuses and golden bomber jackets to staff who came up with winning prompts,7,0.7906,0.6325078
1ec5ntz,technology,X's AI chatbot 'Grok' spread misinformation about Minnesota's ballots. Does the tech giant care?,89,0.2263,0.92360204
1ec55y2,technology,"Cameo was once valued at $1 billion. Now it's so broke it can't pay a $600,000 fine.",1371,-0.2529,0.93854547
1ec4ngm,technology,Blumenthal’s kids online safety act advanced by U.S. Senate,21,0.5859,0.7901811
1ec45y4,technology,"PSVR2 App Will Be Available On Steam In August 2024, Hardware Requirements Revealed",10,0.0,0.69057715
1ec41bb,technology,"With Google in its sights, OpenAI unveils SearchGPT",5,0.0,0.52798754
1ec3phr,technology,SAG-AFTRA Video Game Performers Go on Strike After Contract Talks Stall on AI,66,-0.3182,0.9298135
1ebwagl,technology,Spotify Is Signaling More Price Increases in the Future,12,0.0,0.76225084
1ec365q,technology,Forget Sora — Kling AI video is now available to everyone,0,-0.2263,0.0
1ec2u3v,technology,"The streaming wars bring a new discounted bundle: Disney+, Hulu and Max",19,-0.5267,0.0
1ec2sfb,technology,FTC targets Mastercard in major investigation into AI-based surveillance pricing | You could be paying more than your neighbor for the same product from the same vendor,3,0.0,0.8278586
1ec25ah,technology,"Secure Boot is completely broken on 200+ models from 5 big device makers | Keys were labeled \"DO NOT TRUST.\" Nearly 500 device models use them anyway",59,-0.2484,0.918747
1ec23hl,technology,OpenAI announces a search engine called SearchGPT; Alphabet shares dip,66,0.296,0.8637773
1ec1m7e,technology,"OpenAI announces SearchGPT, its AI-powered search engine",23,0.0,0.6024164
1ec1lye,technology,Machines might not take your job. But they could make it worse.,4,-0.631,0.6066365
1ec1ka3,technology,How Government Programs Help Fuel Tesla Profit,6,0.6808,0.6230305
1ec1j4c,technology,"How Olympics Officials Try to Catch \"Motor Doping\"",4,0.0,0.60982877
1ec0pz6,technology,Las Vegas transit system is nation's first to plan full deployment of AI surveillance system for weapons,11,-0.4404,0.70550746
1ec0nq2,technology,"New method turns banana waste into green textiles, energy | Scientists estimate that the banana agricultural waste in Pakistan could yield 57,488 million cubic meters of syngas.",4,-0.5423,0.7687117
1ec0nle,technology,"Israel tried to frustrate US lawsuit over Pegasus spyware, leak suggests",7,-0.743,0.7703815
1ebzxj2,technology,Court ruling may kill FCC fund that boosts broadband access and affordability,4,-0.5267,0.84519583
1ebzjsy,technology,Reddit Institutes Pay-to-Play Blockade Against Microsoft Bing,0,0.0,0.48694196
1ebyzf4,technology,TikTok source code stolen?,3,-0.4939,0.47319752
1ebyk53,technology,"Israel’s New $1.2 Billion Laser Will Be Nearly Unstoppable—And America Wants One, Too",180,0.0,0.9056694
1ebyd3x,technology,We are Olivia Carville and Cecilia D'Anastasio and we cover online child safety issues and the video game industry at Bloomberg News. We recently finished an investigation on Roblox's struggles to keep pedophiles off the platform. Ask us anything!,59,-0.795,0.7705556
1eby8ag,technology,Non-Google search engines blocked from showing recent Reddit results | Ars Technica,87,-0.2732,0.930647
1eby6xp,technology,"Racist, misogynist online disinformation is already being used against Kamala Harris' campaign",172,-0.6124,0.67119944
1eby64b,technology,Machines might not take your job. But they could make it worse,1,-0.631,0.6515308
1ebxz0t,technology,Adobe exec compared Creative Cloud cancellation fees to ‘heroin’,26,0.4404,0.89380914
1ebx9ru,technology,"Data breach exposes US spyware maker behind Windows, Mac, Android and Chromebook malware | The Minnesota-based Spytech snooped on thousands of devices before it was hacked.",1,-0.4939,0.80762
1ebwxo3,technology,"Spotify wants you to get Deluxe, a more expensive version with lossless audio and other perks",81,0.0,0.5639756
1ebwx5n,technology,Why It's So Easy to Fire Tech Employees These Days,210,0.1354,0.9007908
1ebwesr,technology,"Cars Are Now Rolling Computers, So How Long Will They Get Updates? Automakers Can’t Say",206,0.0,0.92016715
1ebwdpl,technology,Microsoft’s World of Warcraft Workers Vote to Unionize,26,0.0,0.92472243
1ebw1d1,technology,"AI could enhance almost two-thirds of British jobs, claims Google",6,0.0,0.0
1ebvflf,technology,Exclusive: This is the Google Pixel 9 Pro in All 4 Colors,0,0.128,0.0
1ebvbuu,technology,Bye Bye Superbugs? New Antibiotic Is Virtually Resistance-Proof,459,0.0,0.88485503
