link_id,body,score,sentiment_score
t3_1ec55y2,"My dad got me a cameo of John Noble since we’re fans of Fringe. It was supposed to be 30 seconds, but he gently and warmly rambles on for two and a half minutes mostly about dogs and then mentions this is the last cameo he was doing for a while because he was about to get dental surgery. Like, leaving for the appointment in an hour. He showed his missing tooth. It looked like it was really early in the morning. It makes me so happy!! Best birthday gift ever.",20,0.9867
t3_1ec55y2,I got the todd from scrubs to do a bday thing for my brother. Totally worth it,18,0.2944
t3_1ec55y2,Wave your hands in the air like you don’t care…,37,0.3612
t3_1ec55y2,"My dad had a huge health scare and after being in ICU for 50 damn days and getting a supposed 82 gallons of blood transfused finally came home and lived with my wife and I for awhile until he recovered enough to live by himself.

During this we would watch TV show marathons and our favorite that we watched many times was The Orville. My dad loved Bortus and it was by far his favorite character.

I came across Cameo and sure enough Peter Macon AKA Bortus was on there , bought him it for a Xmas present.

He recorded a pretty long, great vid that really touched my dad and made him tear up. He has been going thru a hard time and afterwards definitely seemed in better spirits.

Peter, if you are reading this I greatly appreciate the message you made for my dad",18,0.9722
t3_1ec55y2,"Damn, word up is no longer the code word…",66,-0.5994
t3_1ec55y2,"When normies can’t pay their government fines, they go to jail. Why do they get to negotiate the fine down? Let’s jail the C-suite if they violate the law and can’t pay for it.",42,-0.4939
t3_1ec55y2,"It's hard to understand them going broke, without just being irresponsible with debt and growth. They literally just take a cut of each transaction, and built a network of people buying and selling. Their only totally necessary costs would be a handful of IT folks to keep the system running.",41,-0.4203
t3_1ec55y2,"On one hand, it was very cool to have Alice Cooper say happy birthday to my partner. On the other hand, it was so low effort as to seem almost like someone was holding him hostage.",42,0.9034
t3_1ec55y2,I asked Mick Foley to cut a promo for my wedding and he went above and beyond and sent me back a 7 minute video using all three of his wrestling characters and seamlessly blended it together. One of the best things I've ever gotten lol,14,0.7096
t3_1ec55y2,"One of my best friends was diagnosed with lung cancer, so my brother and I threw down anonymously to have Chuck Norris send an encouraging message to “Kick cancer’s ass.” Chuck cleaned it up a bit and said “Kick cancer’s butt.” It was pretty funny and my friend just loved it. 

He had so many friends and everyone loved him, and he was asking around trying to figure out who sent it. We just played dumb. My friend has since passed, but we never told him it was us, because it seemed like a good way to let him know he was loved by everyone.",13,0.9806
t3_1ec55y2,"Always take the money.

Anyone remember dig? Or yahoo? Or aol?",12,0.0
t3_1ec55y2,Shooter McGavin is $250,26,0.0
t3_1ec55y2,"I had never seen the value in paying for an actor to wish someone a happy birthday, which is usually what it was advertised as. It was only upon seeing the video of the D&D campaign using Gilbert Gotfried to voice their final boss that my friends and I realized the fun we could be having. Never ended up having something similar enough to that to warrant getting a cameo, though it seems like if you are an entertainer it's an easy way to make a funny ad. Came across an Onlyfans model who got Billy West to do his Professor Farnsworth \"Good News Everyone!\" To make an announcement. 

Unfortunately the most use I have seen of it recently has been a bunch of celebrities paid to read off endorsements for things they don't actually stand behind, like gambling apps.",25,0.9749
t3_1ec55y2,"this is tech in a nutshell. a lot of tech companies don’t make money. the game is get some vc’s to invest. give the company a runway to gain market dominance even if they don’t turn a profit. if they accomplish this successfully, tech giants scoop up the company, vc’s cash out and call it a day. this is not accomplished successfully very often and thus you get companies like cameo",11,0.9589
t3_1ec55y2,Came here thinking it was 80s R&B star Cameo! So glad it's not and that he is financially safe...whew!,19,0.5963
t3_1ec55y2,Cameo is like Dancing With The Stars in that the only celebrities they can get aren't really celebrities anymore.,17,0.3612
t3_1ec55y2,"I got one for my dad (who had to dress in full Kiss attire for work due to losing a work contest) from Dee Snyder during the covid years, and Dee absolutely nailed it.

But that’s the only one I’ve ever done.

Recently looked up getting one from Ric Flair for my old man, as he’s a huge fan, but the first demo from Ric on the website looked like he was hammered and mailing it in.",8,0.85
t3_1ec55y2,"During the pandemic shutdown my sister bought me a birthday greeting from Miltos Yerolemou, aka Syrio Forel, First Sword of Braavos! I loved it, but when I realized this company would not likely last I immediately backed up the video to my Google Photos account lol.",15,0.8122
t3_1ec55y2,I paid the voice of master shake to roast my wow guild and it was 100% worth it,15,0.6124
t3_1ec55y2,"I've paid for over a dozen Cameos.

For over a year I had different people tell my friend he sucks. It was hilarious and worth the $20-$100 a month. Eventually they made him and I have to download an app if we wanted to watch the videos.


Ew.

I did one or two after that but it just wasn't he same.",14,0.3919
t3_1ec55y2,"Earlier this year I got my mother a birthday greeting from John Kruk. He’s a retired baseball/tv announcer. She absolutely loved it and is still showing people the video to this date. 

I was going to get Bryce Harper to do a birthday message for my son… until I saw the insane price for it. 

I don’t have too much to add besides I like the service - just wish it was less predatory and better managed.",7,0.8985
t3_1ec55y2,"If the standard for being broke is not being able to pay a 600,000 fine, I am FUCKED",7,-0.8192
t3_1ec55y2,"When it started I remember prices for a lot of the B/C-tier ones being pretty fair and the celebs involved were really into it 

Most Cameos now that are just insanely low effort, the celeb plugging some random thing, or  really basic 

The high end ones cost $500-600 and even if you’re splitting it between friends it’s much more worth it to just go to a dinner or get a really nice gift 

At this point the target demo is really young or really old people or people creating cheap knockoff Candy Crush scams",7,0.8949
t3_1ec55y2,My now wife hired a former player from my favorite soccer team to tell me she was pregnant. It was an incredible message from a club legend that she picked at random,8,0.4588
t3_1ec55y2,My cameo from Kevin Conroy is very import to me.,8,0.0
t3_1ec55y2,Hopefully Gilbert Gottfried's family has most of that money.,7,0.4019
t3_1ec55y2,I’m surprised Rudy Gulianni and George Santos couldn’t keep it afloat.,6,0.2263
t3_1ec55y2,"I mean, to be fair, being *valued* at $1 billion, and having $600,000 in cash are two very different things! I could easily value myself at $1 million, while not having $60 to pay for a pizza delivery lol",5,0.8313
t3_1ec55y2,"I think Cameo is actually a great little business. It was victim to some of the most extraordinary conditions in the tech market and became the poster child of exuberance and over valuation. Which is a shame because I think it's a wholesome enterprise.

It's like the convention circuit where people can meet stars of their favorite media. The star, usually past their prime, get some income and people get a human connection to entertainment they love.

Doesn't depend on gambling like micro transactions or toxic algorithms or obsessive engagement. Just a moment of human connection.

I like it more than I like any social media company or mobile game.

I know it gets to be the butt of jokes about a massive fall from grace but I hold no ill will towards it. I hope they right the ship and continue to delight people with little moments of levity even if it's not the next big thing.",5,0.9442
t3_1ec55y2,"Most celebs were waaaaaaaaaaaaaaaaaay too proud of their cameos.

When the D listers were charging hundreds of dollars, that was it.  Nobody is paying $400 to have the dude from Imagine Dragons wish them a happy birthday.",16,0.8591
t3_1ec55y2,"Once you see Rudy Guilliani grifting on there, you know you shouldn’t be on there",12,0.0
t3_1ec55y2,Maybe stop assigning things stupid arbitrary values. DJT Media would be a good example,39,0.0
t3_1ec55y2,Maybe do some cameos to raise money,5,0.0
t3_1ec55y2,"I'm pretty sure half of their revenue came from Gag gifts and they never realized it.

There are not as many superfans of Celebs on their roster as you'd think and also, the economy hasn't been great for a while, and it's a very random impulse buy kind of thing. I'm not an expert in economics, but I'd imagine something like this would see a huge decrease before Uber Eats and Air BnB did.

Another thing is, they've done a bad job in the marketing aspect. They could be way more present in pop culture, sponsoring events, award shows, partnerships, and being part of the pop culture ethos.  
They could have expanded more to influencers, streamers, and global markets.  
Also, they haven't productized or made use of the brand at all, or their roster itself for that matter",5,0.7394
t3_1ec55y2,I can’t even imagine what a job at cameo is,5,0.0
t3_1ec55y2,A company valuation has nothing to do with how much cash is in their bank account. The shareholders have that billion not the company,4,0.0
t3_1ec55y2,That's a shame. They made for fun birthday gifts and stuff. When my nephew was about to be born I had the voice actor for snake from metal gear solid tell my cousin that fatherhood is hard but he can be it just like the ladder boss in mgs 3 lmao ,6,0.8689
t3_1ec55y2,"My friends got me a cameo from Jackie Chiles from Seinfeld for my bday, the actor in full costume and character riffed for like 3.5 minutes. It was amazing, I watch it every year on my bday.",6,0.8555
t3_1ec55y2,"We all know Cameo went down hill after Gilbert Gottfried passed a couple years ago, His were by far the best.  
RIP.",6,0.6369
t3_1ec55y2,"Word up, it’s the code word,


No matter where you say it,
You’ll know that you’ll be heard.",5,-0.2732
t3_1ec55y2,Oh man that sucks. This was a cool way to get a cool gift message for someone. I got my Girlfriend Falica Day for her B-day one year. She loved it. I was going to get one form Misha Collins at some point when I could afford it.,6,0.836
t3_1ec55y2,"That’s rough.

The CEO should do a Cameo or something to make ends meet. ",13,0.0
t3_1ec55y2,You mean to tell me that stock market valuations are almost never tied to the real value of a company!?  Say it ain't so!,18,0.4559
t3_1ec55y2,My wife got me Trevor Strnad to tell me happy birthday. He talked about how hard it is to get older.,5,0.5106
t3_1ec55y2,Seeing this post reminded me that Cameo was a thing that exist(ed),5,0.0
t3_1ec55y2,"I got my friend a Cameo from Latrice Royale for his 50th birthday, and he absolutely loved it.

Latrice delivered the goods, and I was very satisfied with the entire experience.",4,0.8882
t3_1ec55y2,"Being valued at $1billion and having over half a million in an account to liquidate are different things, but still. Fell off a cliff.",4,0.2382
t3_1ec55y2,"For my partner's birthday one year, I asked his friends to secretly record videos. I sent one to my partner every hour. 

My partner had been binging SVU so I also got a Cameo from Ice-T and threw that in the mix toward the end of the day. (Ice-T did a fantastic job fitting in my specific details in a really positive and warm message!)

It took my partner a full ten seconds to comprehend what was happening. He ended up appreciating his friends' videos way more than the Cameo, but I at least had fun watching his face when he realized.",3,0.9339
t3_1ec55y2,I always thought that was a cool idea,4,0.3182
t3_1ec55y2,"It’s almost like hype has taken over responsible valuation. Does this shock anyone? 

Brands that have historically achieved sustainability and longevity don’t rely on celebrity hype. Sure, they’ve used sponsorship to boost the brand, but the brand has always been paramount to the marketing of any successful company, and celebrity association was used as a mark of connection and achievement.

Now it’s a fucking shit-show. YouTube “celebrities” are selling their mark for fucking pennies to begging brands. Decks are floating all over the place featuring “celebrities” who will be forgotten within 2 quarters, and short-sighted idiots are lapping it up.

And Cameo is this mess, The Company.

The market is full of a bunch of low-rent assholes begging celebrities to tweet their garbage products as quickly as possible so that they can exit at the expense of some stupid sucker who thinks that equates to value. 

There’s a reason a brand like Liquid Death will stomp through value and actually be worth it while others beg and plead for YouTuber endorsement - they have faith in their brand.",4,-0.6955
t3_1ec55y2,How are they not making money?,4,0.0
t3_1ec55y2,"I paid the now deceased Batman voice actor Kevin Conroy to record a birthday message for my best friend who's a huge Batman fan. The message opened with Batman's voice wishing him happy birthday, this was before AI bs, and I recorded my friend's reaction. Kevin even added some life wisdom for when things get rough. To this day it's the best gift I've ever given someone, it's something else to see a grown ass man shedding tears because the recieved gift means so much.",4,0.9766
t3_1ec55y2,"Hey James from Idaho, uhh a little birdie told me it’s your birthday today and uhh you’re also a big fan of Gwimbly umm oh yeah Ew Ew Ew, uhh and I’m seeing here I should also tell Tyler to go to hell, I don’t know who Tyler is or what that means so",7,-0.2732
t3_1ec55y2,Yes it's really meant for like c list celebs that appear on reality TV and such.,7,0.6666
t3_1ec55y2,Maybe now we can finally stop seeing celebrities talking about how much they *looove* whatever bullshit mobile clash of clans clone and how they definitely actually play it *cough* Patrick J Adams *cough*,6,-0.2263
t3_1ec55y2,I once paid Doug Cockle to say Dummy Thicc as Geralt.,6,0.0
t3_1ec55y2,I was having the set of my fucking life! SOMEBODY GET THIS GUY OUTTA HERE!,3,0.0
t3_1ec55y2,“Valued at” figures don’t really mean much when it comes to cash flow.,3,0.0
t3_1ec55y2,It’s the place where influencers go to capitalize on their 9 minutes of fame.,3,0.4404
t3_1ec55y2,Cameo is great. I got a convicted drug dealer to give my team a pep talk about the importance of planning ,3,0.765
t3_1ec55y2,"So much fake money on the internet with the hidden costs of things like bandwidth and site maintenance

And now that we know it’s all to get our cookies a reckoning is imminent",3,-0.2212
t3_1ec55y2,I got my best friend a birthday wish from their favorite voice actor and that was the best day ever!,3,0.9558
t3_1ec55y2,Probably because every celeb is unavailable that people try,3,0.0
t3_1ec55y2,We still regularly share the Cameos that Dean Ween did. We do it from time to time in r/ween,3,0.296
t3_1ec55y2,"Like with Juul, Cameo was too new and naive to know you have to pay off the right people in government so they will leave you alone.",3,-0.3535
t3_1ec55y2,My favorite bass guitar player Ryan Stasik of Umphrey’s Mcgee sent me a cameo via my sister during covid and well i cried and was coolest thing at the same time!,3,0.4199
t3_1ec55y2,"Can anyone ELI5 what happened? I don't really understand how a billion dollar company like this goes under, I can't imagine the overhead costs are that high to keep the servers running ( I am not a tech guy though so please don't shiskabob me) did celebrities quit using it ending the revenue or what?",3,0.7051
t3_1ec55y2,I got my friend a birthday shoutout from NikacadoAvocado and it was like 4.5 minutes long and well worth it lol. Dude must be crazy or a great actor.,3,0.9217
t3_1ec55y2,"> Cameo was once a tech darling. 

Gonna stop you right there...  so you pay some money for someone to record a short video for you. What tech?",3,0.2315
t3_1ec55y2,They should like put these on YouTube and monetize them. I want to watch a lot of these weird ones,3,0.2732
t3_1ec55y2,"\"valued at\". I wish people would understand that a valuation means nothing. A company is only worth what someone is willing to pay for it. People talk about realms they will never visit.",3,0.7269
t3_1ec55y2,"Stephen Tobolowsky did one for my old boss' wife who had terminal cancer. Groundhog day was one of their favorite movies and he dressed up as Ned Ryerson, drew them a groundhog picture, and left a very sincere message for them. 

Best $100 our team ever spent.",3,0.6997
t3_1ec55y2,"Best one was a Christmas present for my brother. I got [Kevin Conroy](https://www.youtube.com/watch?v=iVjrMCrOKJI&t=1918s) to wish my brother and his fiancé a congratulations for the engagement and on the upcoming wedding. He rambled for almost ten minutes, and it was my brother’s favorite gift ever. He’s a huge Batman nerd. RIP KC",3,0.9628
t3_1ec55y2,because it never really had that value. that was just a number someone put on it so people would buy stocks.,3,0.4522
t3_1ec55y2,I have never heard of this company before,3,0.0
t3_1ec55y2,"I've ordered a few cameos, but I have noticed most were pandemic timed. I'm super awkward and worry about how to ask about things.

William Daniels/Mr. Feeny was short and nice. About what I'd expect for someone his age.

Bought a couple from Cristina Vee. One for me, and one for a friend, but she's super nice.

Kurt Angle for my dad on Father's Day, it was short, to the point, and he quoted my paragraph. Dad loved it.

Rick Harrison for my dad on Father's Day the next year. His was funny, a lot of his signature laugh in there.

Nana Faye Chrisley, I got for my ma because we loved watching Chrisley Knows Best, and it's the longest one. She talked about family love, religion, and casinos. About 7 minutes. Brought tears to mom's eyes.

James C Burns is great. He's Woods from Black Ops. He did some quotes and thanked me for being a fan.

David Hayter's is great. You can also tell he has a script handy for all his Snake phrases. Still, hearing Snake tell you \"you're pretty good\" is one big serotonin boost.",3,0.9979
t3_1ec55y2,Ha! I was bummed when they interviewed me an I didn’t get the job. Would rather not have this turd on my resume!,3,0.4559
t3_1ec55y2,"Best I got was Gilbert Gottfried, Kevin McDonald and David Foley for my sister’s 40th and half of Anthrax for my Wife’s birthday.  It was a good service for its time!",3,0.8122
t3_1ec55y2,My husband got me cameos of the voice actors of Arthur and Dutch from RDR2. It was my Christmas present the year we found out we were having our first kiddo.,3,0.0
t3_1ec55y2,It's almost like valuations are 100% complete made up bullshit with no real world applications what so ever.  Weird.,3,-0.6976
t3_1ec55y2,"I'm surprised that because they can't pay a $600k fine, the government said they drop it to a $100k fine instead. 
Shouldn't they be put into liquidation?",3,-0.2705
t3_1ec55y2,"How???

Seems like it is one step from printing money, you take a cut of people paying sometimes hundreds of dollars for a short video.

like sure, you need staff to deal with refund requests and such, and to maintain the website etc but so does literally every business...",3,0.4836
t3_1ec55y2,I loved Cameo at first because you could book a D level celeb that a friend or family member might like for $20-50.   Now it’s insanely expensive in comparison.  The $20-50 was a good range for a little fun gift idea.  $200+ dollars is is way out of most people’s reach for a joke/fun gift.,3,0.9644
t3_1ec55y2,This is the problem with valuing businesses. It’s a false value from the beginning.,3,0.2732
t3_1ec4ngm,"Even in an article format, Blumenthal's consistent non-answers to every criticism were so awkward that I felt secondhand embarrassment from reading it.

All the 'adjustments' to criticism in the bill seem to focus on the specific intent of the bill and not, y'know, the potential it has to unconstitutionally punish free speech. It *really* doesn't seem like they've done much to prevent this bill from being used in aggressive, potentially partisan ways.

There's a fuckton of legislative formats to address this from the gambling angle, not the one that coincidentally threatens first amendment rights. If the whole argument is, *\"The only way we can confront these corporations is to vaguely threaten corporations/people on an individual and unconstitutional basis\"*, then your plan. Is. Bad.",69,-0.9726
t3_1ec4ngm,If a law has kids in the title it probably is a bad law ,23,-0.5423
t3_1ec4ngm,"If you want to help stop this bill contact your lawmakers here.

https://www.stopkosa.com/

The Senate are planning to fully vote on this as soon as next week.

Edit: [FFTF statement on this](https://www.fightforthefuture.org/news/2024-07-23-fight-for-the-future-statement-on-the-kids-online-safety-act/)",19,0.2023
t3_1ec4ngm,"You’d be surprised how many parents are in favor of this.  here is more info 

https://youtu.be/csubiPlvFWk?si=roq_D7EnbxDCorwg",1,0.5574
t3_1ec4ngm,"Disclaimer, I despise Trump far more than Biden, and I hate Biden far more than any other politician (aside from Trump).

Biden pushed various legislation over the years that was voted down by both Republicans and Democrats as being unconstitutional. Then 9/11 happened, and Biden gathered up all his failed pro surveillance and “Police State” legislation, then went to all the 3 letter agencies and basically said “what powers do want but never dared to ask/hope for?” Then he bundled all that bullshit up and turned it into THE PATRIOT ACT. Most senators and congressmen weren’t even allowed to read what was in the bill, they were just told they needed to vote for it, and it had to be secret so as to not tip off our enemies.

It was packed full of all the unconstitutional bullshit that all those Congress people had voted down time and time again.",-17,-0.9672
t3_1ec4ngm,"Im all for this. The data proves social media is being harmful to kids and big tech is not doing the right thing when they chase that huge stock growth. 
The law is bipartisan and there’s still a long way to go. 
Hopefully it will also help get smartphones banned at schools, or at least the apps that are distracting for kids.",-27,0.6249
t3_1ec45y4,This should have been a launch feature.,5,0.0
t3_1ec45y4,"According to Steam, a PS VR2 PC adapter will be required, which will be sold for $59.99. Some PS VR2 features, such as HDR and eye tracking, will not be available on PC. SteamVR games will have individual requirements, so it’s important to check the requirements for each game.",5,0.2682
t3_1ec45y4,"I think this means they plan to completely drop support for it, they just want to give it some more longevity for people who bought it",6,0.2228
t3_1ec45y4,"Windows only 💀 

Hopefully it works through Proton",1,0.4019
t3_1ec41bb,"Their search is so polluted with extraneous junk now (or I presume it still is, I haven't done a google search in over a year), they fully deserve this.",4,-0.5949
t3_1ec41bb,Before that they have to compete with BING.,1,0.0
t3_1ec3phr,I hope SAG-AFTRA wins.,89,0.765
t3_1ec3phr,Good fuck companies that use AI for this,56,-0.1531
t3_1ec3phr,"That’s ok, it gives us all a chance to catch up on our Steam library purchases.",6,0.4939
t3_1ec3phr,I wish them the best.,14,0.7845
t3_1ec3phr,"I am all for voice and mocap actors getting paid their fair share. I also am not fully read in to what their ai demands entail. But I hope they are not trying to limit what a video game is capable of. Having an AI generated voice for a character opens up thousands of possibilities for personalized narration and dynamic scenes that wouldn't be feasible if every single line had to be fully recorded by a human. These actore fully deserve credit and payment for how they are able to bring life to a character in a game. I am not advocating that voice actors be replaced with ai, but saying you can't use any form of ai voice seems like it would be an unnecessary limitation on developers. Games like balders gate would be amazing if every name you give your character was spoken aloud durring dialog. Or they could compensate the actor for their original recordings at a rate which would account for some later added features needing to use a trained ai to add in a few lines here and there for story line changes or added quests. It would also save time and money for the developers if they didn't have to bring the talent back in to a recording studio for a few lines added or changed.",12,0.9895
t3_1ec3phr,"Downvote away since I know this sub hates ai for some reason, but I'd rather AI proliferate in gaming since most stuff isn't voiced anyway due to cost. AI is needed here so we can have fully voiced interactive games that just aren't financially possible otherwise. If these people get their way it will be bad for everyone.",2,-0.7717
t3_1ec3phr,"It blows my mind how poorly the VAs are treated currently.  \"the right of informed consent for the A.I. use of their faces, voices, and bodies\" How is this not a given?

The full anti AI stances kill me though.  You know what else kills VA jobs?  Quest markers on a mini map and text.

