link_id,body,score,sentiment_score
I hope the AI voices take over background dialogue to replace the UI features that dumb down the games to follow the '!'  We could have 1000x the emotionless dialogue we currently get and the games would improve for it.",2,-0.8295
t3_1ec3phr,Good.  I respect them fighting for their jobs and for the next generation of actors who have to deal with this too,5,0.5423
t3_1ec3phr,Not sure how much leverage they have here,4,-0.2411
t3_1ec3phr,Wouldn’t that be incentive to implement it faster?,7,0.3612
t3_1ec3phr,"Hell yeah! Right on, comrades!! ✊🤘",2,-0.6458
t3_1ec3phr,Unfortunately this will go no where for them.,0,-0.5574
t3_1ec3phr,"Video game producers: “Uh ok. We will worry about that 2% of the project later.”  If recall the last strike lasted over a year and had no impact on game development. 

Like actors and all but on this I cannot side with voice actors (on money demands, AI stuff agree with). Will change my mind after the game makers that put months and sometimes years into a game get residuals and all the money related demands of the actors. One group puts on hundreds to thousands of hours of work and critical to the game, the other often only puts in dozen or so hours from home and can be replaced by fans if studio wants to put in the effort to find good ones. Voice actors don’t sell games, it’s not like the film industry.",-8,0.2582
t3_1ec3phr,"hopefully this speeds up ai adoption and we just see ai used for these roles instead.

ai is going to drastically speed up dev cycles and lower production costs. the current standard of big budget games taking 5-7 years will be a thing of the past that gets looked at the same way as ps2 load times.",-1,0.128
t3_1ec3phr,"Ai generation isngoing to be used in a lot of things. Its happens, when the first electronic telephone switch was installed. 1500 people per location lost thier jobs. People barely talled about it, sane with the calculator and PC. This happens, ride the wave or be run over by it, if you are in an industry that its coming for.",-1,-0.3182
t3_1ec3phr,I feel like a strike wont do much against ai. It has to be mayor lawsuit that can hinder most of it,-4,0.0258
t3_1ebwagl,I wonder if artists see any royalty pay boost when prices go up lol. Methinks they don't see a fucking dime unless they have an army of lawyers on retainer and fly around in private jet.,8,0.6249
t3_1ebwagl,There are other free great music apps out there. I can give specific name if you want.,7,0.8271
t3_1ebwagl,Cancelled spotify a month ago and went to YouTube premium. more bang for my buck anyway with no ads on videos,3,-0.4939
t3_1ebwagl,Spotube ftw,1,0.4588
t3_1ebwagl,Because they'll pay source providers better. Right? RIGHT?,1,0.4329
t3_1ebwagl,"Reading here, I just realized I don't need a spotify subscription, and really haven't been using it (like someone else here, youtube is winning)

edit: cancelled",1,-0.25
t3_1ebwagl,"Youtube music is better in almost every way (in my experience), and I get adfree youtube at the same time, for just a bit more.",1,0.4404
t3_1ec2u3v,"Discounted Bundles... Wow, we have come full circle...

Piracy is a competitor to corporations. If you don't want people leaning that way, stop racking up costs for less, usable, return.

I don't care if my cable is 500+ channels. I care for the fact I use 5 channel regularly, maybe 10 over all. Stuck across 5 tiers, but paying for 6 tiers for a prices same or less than 5 tiers on their own?

I don't binge watch shows. I watch the movie or series once, and that's usually it. It might be 9months to a year before I'm interested in watching again.

$15 a month in say New York is valued less than very rural areas like central US, in my case Oklahoma and Kansas. It might take the average person a fraction of an hour, up to an hour, to make $15. Good on them. Many in rural areas it may take up to 2 hours of work. (After taxes.) Value matters.

Let's not forget signing up for a service, and months later they change the agreements, barely say anything to the users (*but we sent out an email that almost no one looked at!*), and wonder why people are complaining or leaving.

Personally, like many others, if I signed up for a service with understanding and agree to version 1 of the agreement that was out at that moment I clicked agree, I expect that agreement to stay the same while I continue to pay. If that agreement is changed, I should not only have to re-agree to that change, but should not be effective until the renewal of the prior paid agreement ends, and I should not be charged again until I agree to the new changed agreements. *But people will be inconvenienced!* We already are.

Oh, to add in my favorite. Let's say you're paying for 4K video, you're lucky to get that unless you have exactly what they allow hardware and software wise. Not using the approved Intel chip? You're not watching 4K. Not using Google Chrome/Edge/whatever, but using Firefox? No 4K. Smart TV a year past application support? No 4K. And they keep moving the goal posts!

Edit: Typos/grammar",10,0.9964
t3_1ec2u3v,Includes Max in HD not 4K...,2,0.0
t3_1ec2u3v,"Sooo, cable Tv?",2,0.0
t3_1ec2u3v,"Direct link - https://www.disneyplus.com/welcome/disney-hulu-max-bundle

I don't have an opinion on it yet - but $30/month ad-free option seems a bit much. 

My situation is very messed up. 

I currently have Netflix, Disney+, Hulu and MAX. 

I get Hulu from the grandfathered Spotify student subscription. 

I need to spend a day to figure out my billing as D+ and MAX are annual subscriptions and rest all are monthly. Absolute nuts.",3,-0.7572
t3_1ec2u3v,Watch more mind numbing dirge than you could ever need.,1,-0.3353
t3_1ec2u3v,Was just trying badly to make a pirate comment like yaar I pirated a pirate now I be a super pirate,1,0.5106
t3_1ec2u3v,"Here's an idea: let's combine them all into one service, put them into an easily installed box, remove the ability to choose when the shows play, and add in some commercials for the priveledge of paying for our service. Then we could put one distributor in each small town and triple the prices because \"where else are they gonna get it?\"",-1,0.7269
t3_1ec2u3v,Having cable and a freaking VCR again is starting to sound pretty good.,0,0.5106
t3_1ec2u3v,now i have to do math again to figure out if i should switch or keep my annual subscriptions. so annoying. why don't any of these bundles have an annual option?,-1,-0.541
t3_1ec2sfb,"It seems that the FTC is seeking to better understand the opaque market of third-party products that claim to use advanced technologies for price monitoring.

They are now looking for information on the types of price monitoring products and services, data collection, customer information, and the impacts on consumers and prices

What a mess!",5,0.4003
t3_1ec2sfb,"The commissioner’s statement on Surveillance Pricing is such corporate bootlicking: “This term’s negative connotations may suggest that personalized pricing is necessarily a nefarious practice. In my view, we should be careful to use neutral terminology that does not suggest any prejudgment of difficult issues.”  
  
Does anyone really think corporations aren’t going to sell something to you at the highest price they think they can get? Then you get companies that may not want a certain demographic walking around with their products, or don’t want “those people” as customers, so they use this data to ensure the customers never see a price that would be remotely sensible.",7,-0.6437
t3_1ec25ah,"The following companies used either a key that was known to be compromised or keys that were meant just for testing in production:

- Acer
- Dell
- Gigabyte
- Intel
- Supermicro
- Aopen
- Foremelife
- Fujitsu
- HP
- Lenovo

Will companies ever be meaningfully punished for negligent acts like this?",214,-0.128
t3_1ec25ah,"Some of the pertinent issues:

>On Thursday, researchers from security firm Binarly revealed that Secure Boot is completely compromised on more than 200 device models sold by Acer, Dell, Gigabyte, Intel, and Supermicro. The cause: a cryptographic key underpinning Secure Boot on those models that was compromised in 2022. In a public GitHub repository committed in December of that year, someone working for multiple US-based device manufacturers published what’s known as a platform key, the cryptographic key that forms the root-of-trust anchor between the hardware device and the firmware that runs on it. The repository was located at https : //github.com/raywu-aaeon/Ryzen2000\\_4000.git, and it's not clear when it was taken down.  
>  
>The repository included the private portion of the platform key in encrypted form. The encrypted file, however, was protected by a four-character password, a decision that made it trivial for Binarly, and anyone else with even a passing curiosity, to crack the passcode and retrieve the corresponding plain text. The disclosure of the key went largely unnoticed until January 2023, when Binarly researchers found it while investigating a supply-chain incident. Now that the leak has come to light, security experts say it effectively torpedoes the security assurances offered by Secure Boot.  
>  
>“It’s a big problem,” said Martin Smolár, a malware analyst specializing in rootkits who reviewed the Binarly research and spoke to me about it. “It’s basically an unlimited Secure Boot bypass for these devices that use this platform key. So until device manufacturers or OEMs provide firmware updates, anyone can basically… execute any malware or untrusted code during system boot. Of course, privileged access is required, but that’s not a problem in many cases.”  
>  
>...  
>  
>The researchers soon discovered that the compromise of the key was just the beginning of a much bigger supply-chain breakdown that raises serious doubts about the integrity of Secure Boot on more than 300 additional device models from virtually all major device manufacturers. As is the case with the platform key compromised in the 2022 GitHub leak, an additional 21 platform keys contain the strings “DO NOT SHIP” or “DO NOT TRUST.”  
>  
>These keys were created by AMI, one of the three main providers of software developer kits that device makers use to customize their UEFI firmware so it will run on their specific hardware configurations. As the strings suggest, the keys were never intended to be used in production systems. Instead, AMI provided them to customers or prospective customers for testing. For reasons that aren't clear, the test keys made their way into devices from a nearly inexhaustive roster of makers. In addition to the five makers mentioned earlier, they include Aopen, Foremelife, Fujitsu, HP, Lenovo, and Supermicro.  
>  
>...  
>  
>There's little that users of an affected device can do other than install a patch if one becomes available from the manufacturer. In the meantime, it's worth remembering that Secure Boot has a history of not living up to its promises. The most recent reminder came late last year with the disclosure of LogoFAIL, a constellation of image-parsing vulnerabilities in UEFI libraries from just about every device maker. By replacing the legitimate logo images with identical-looking ones that have been specially crafted to exploit these bugs, LogoFAIL makes it possible to execute malicious code at the most sensitive stage of the boot process, which is known as DXE, short for Driver Execution Environment.  
>  
>“My takeaway is ‘yup, \\[manufacturers\\] still screw up Secure Boot, this time due to lazy key management,’ but it wasn't obviously a change in how I see the world (secure boot being a fig leaf security measure in many cases),” HD Moore, a firmware security expert and CTO and co-founder at runZero, said after reading the Binarly report. “The story is that the whole UEFI supply chain is a hot mess and hasn't improved much since 2016.”

It's pretty disappointing that so many major vendors managed to mess this up so badly in their devices. Perhaps better QA/QC processes or industry standards might be needed if this is shaping up to be an industry-wide problem.",62,0.9292
t3_1ec25ah,Ahh secure boot.  The good idea that everyone hates and is sometimes utterly broken.,37,-0.2484
t3_1ec25ah,"I seem to remember concerns about such things happening when Secure Boot first began to be talked about. Nice to know that no one bothered to take those concerns seriously. Not that it is surprising.

Kind of like Samsung using a known compromised signing key for their apps in their app store, which they were still doing as of a year or so ago. It is a mostly victimless crime with nebulous outcomes because no one that matters really wants to put in the work to see how bad it really is and stop it from happening. No money in the fix so to speak.",11,-0.8207
t3_1ec25ah,"This is just \"Secure Boot\" - one of the most worthless, and, at times, anti-consumer \"security measures\" imaginable.

Not at all surprised to see vendors treat it with all the care and respect it deserves.",7,0.8377
t3_1ec25ah,"This is the best tl;dr I could make, [original](https://arstechnica.com/security/2024/07/secure-boot-is-completely-compromised-on-200-models-from-5-big-device-makers/) reduced by 80%. (I'm a bot)
*****
> On Thursday, researchers from security firm Binarly revealed that Secure Boot is completely compromised on more than 200 device models sold by Acer, Dell, Gigabyte, Intel, and Supermicro.

> &quot;It&#039;s basically an unlimited Secure Boot bypass for these devices that use this platform key. So until device manufacturers or OEMs provide firmware updates, anyone can basically execute any malware or untrusted code during system boot. Of course, privileged access is required, but that&#039;s not a problem in many cases.\"

> The researchers soon discovered that the compromise of the key was just the beginning of a much bigger supply-chain breakdown that raises serious doubts about the integrity of Secure Boot on more than 300 additional device models from virtually all major device manufacturers.


*****
[**Extended Summary**](http://np.reddit.com/r/autotldr/comments/1ec2soa/secure_boot_is_completely_broken_on_200_models/) | [FAQ](http://np.reddit.com/r/autotldr/comments/31b9fm/faq_autotldr_bot/ \"Version 2.02, ~691115 tl;drs so far.\") | [Feedback](http://np.reddit.com/message/compose?to=%23autotldr \"PM's and comments are monitored, constructive feedback is welcome.\") | *Top* *keywords*: **key**^#1 **Boot**^#2 **device**^#3 **Secure**^#4 **security**^#5",3,0.9151
t3_1ec25ah,"Secure boot is just an extra layer of security, people should really chill up.

Hell, by the time an attacker get even near having to worry about it, they could already have screwed you up n-times over.",3,-0.8971
t3_1ec25ah,"Ok, we are all f\\*cked.",-3,0.296
t3_1ec25ah,I use only one key that i generated witb sbctl and signed my boot image and personal usb drive ventoy boot image with.,-1,0.0
t3_1ec23hl,"*Searches for porn*


I'm unable to help with that request. As a language model, I am programmed to follow ethical guidelines and avoid providing or searching for inappropriate content. If you have any other questions or need assistance on a different topic, please let me know!",149,0.75
t3_1ec23hl,We don't need more AI search. We need Google circa 2018 before they caved to ads $ and sacked their head of search.,472,0.0
t3_1ec23hl,That should keep the hype bubble going for a few more weeks.,134,0.0
t3_1ec23hl,"That is just Bing...


 i know nobody is using it, so just might as well remane it and do advertising ",42,0.2732
t3_1ec23hl,"The other day, I wanted to know the latest firmware for a device, so I googled it. 

The Google AI gave me the 2019 answer. The devices website was right below that highlighting the correct answer for 2024. AI sucks.",8,-0.3612
t3_1ec23hl,What kind of dip? Cheese? Bean? Guacamole?,19,0.0
t3_1ec23hl,"If this takes off, I wonder how that's going to affect the Apple and Google relationship.

Apple gets a buttload of cash just for making Google the default search engine on iOS, but they're buddying up with OpenAI now as well with native ChatGPT integration.

Would Google pull the deal to their own detriment out of retribution?

Would OpenAI pressure Apple to pull the deal themselves?

Does Apple value the burgeoning symbiotic relationship with OpenAI more than the easy cash from Google?",16,0.8287
t3_1ec23hl,"I actively change my Google search settings to get rid of all the generative AI content.  I understand why speculators don't see how bad AI is for the user experience, though.  They're just people with more money than sense.

I do not want an AI hacking together a source less, most likely wrong and/or completely fabricated summary for me.  I want my damn question answered.  Generative AI utterly fails to provide any degree of what I am looking for when I search online.

This isn't a question of accuracy, either.  We can literally never trust anything that comes from generative AI.  It does and will always require double checking with real sources.  I will never have any use for a robot that says \"trust me bro.\"",15,-0.8627
t3_1ec23hl,"Does anyone use Perplexity?

It's impressive",7,0.5106
t3_1ec23hl,I cant wait for the AI bubble to pop. The shit is horrendous.,8,-0.8126
t3_1ec23hl,Great. Something else I'll have to explain to relatives why they shouldn't use it.,8,0.6249
t3_1ec23hl,"Google.com delivers Ads now, not search results. Fuck em.",2,0.431
t3_1ec23hl,I'll use it if it doesn't have ads.  Get the most out of Pre-monetized technology while you can.,2,0.0
t3_1ec23hl,"Nah, not using that",1,-0.1027
t3_1ec23hl,"Considering Google search may now be worse than bing, some competition is good. Duck duck go is pretty good too but it has limited resources while Google and chat currently essentially have unlimited resources.",1,0.1531
t3_1ec23hl,Maybe this will work better than the shitheap of irrelevant nonsense Google provides?,1,0.0516
t3_1ec23hl,can it flag content that it generated ?,1,0.0
t3_1ec23hl,Bing search about to be the best search engine.,1,0.6369
t3_1ec23hl,Not surprising given that these days Google search is useless and doesn't provide any relevant results.,0,-0.5594
t3_1ec23hl,"How about we use Yahoo! or AOL search, Ask Jeeves has been rebranded into just Ask, so that’s still available.",0,0.0
t3_1ec23hl,[deleted],-5,0.0
t3_1ec1m7e,"From the article:

> SearchGPT is just a “prototype” for now. The service is powered by the GPT-4 family of models and will only be accessible to 10,000 test users at launch, OpenAI is working with third-party partners and using direct content feeds to build its search results. The goal is to eventually integrate the search features directly into ChatGPT.

So, I guess it's going to be a subscription based feature, right?",11,0.0
t3_1ec1m7e,"This will potentially end a lot of websites depending on execution of this idea.

Currently a lot of websites only barely survive by getting traffic. Since Google started making their summarised answer tables with search results, meaning you don't have to leave Google at all to get a result, means that a ton of websites lost most all of their traffic to Google.

This is absolutely bad because, if SearchGPT summarizes answers from websites directly the same way, then people will see less and less of a point visiting websites, meaning those websites will just die out. This in turn means that Google, Bing and SearchGPT will all choke the internet dead in it's tracks with less and less results to pull from, meaning we'll pull back to private forums again.

So hopefully the course changes. If it doesn't, then the internet will just die out.",18,-0.9615
t3_1ec1m7e,"This seems like a direct competitor to Bing + Copilot. It's weird for Microsoft to be ok with this considering they have a 49% stake in OpenAI.

I guess they still benefit via their investment, but wouldn't they want to at least maintain what little market share they have in the search engine market, as opposed to losing it to OpenAI?

Tail wagging the dog vibes.",10,0.1654
t3_1ec1m7e,Google be shitting bricks right now.,16,-0.4215
t3_1ec1m7e,for all your totally non-toxic pizza toppings!,2,0.0
t3_1ec1m7e,"Welcome to the era of dangerous search results...
It's going to be more wild than Bard .",1,-0.0258
t3_1ec1m7e,Cant we like.. have the old search engine results back instead?,1,0.0
t3_1ec1m7e,"This seems like an absolutely terrible idea.  Like, modern generative ai simply doesn't do \"accurate\".  It does \"likely\", and in common cases, \"likely\" is usually \"accurate\".  However, there are plenty of other, more niche cases where it has no useful information to provide, and so \"likely\" translates to \"plausible sounding bullshit\".

So yeah, this seems utterly useless.  AI-generated summaries and such are pointless if I still have to click through to the underlying link in order to verify that the summary is actually accurate to the link and that the link is remotely trustworthy to begin with.  I think the main result of this will be even more nonsense being spread around the internet.",-2,0.3773
t3_1ec1lye,"**How robots and AI change the meaningfulness of work**

July 19th was a day for help-desk heroes and support superstars. A routine software update by CrowdStrike, a cyber-security company, caused computer outages in offices, hospitals and airports worldwide. Most white-collar workers looked disconsolately at their screens and realised just how useless they are if they cannot log in. People in IT came to the rescue of helpless colleagues and stranded passengers. Their work that day was full of stress—but also full of meaning.

If machines can add purpose to some jobs when they fail, what about when they work properly? This is not an idle question. Discussions about artificial intelligence (AI) in particular easily get lost in hypothetical debates about wholesale job losses or, worse, the nature of consciousness. But technologies tend to spread in less dramatic ways, task by task rather than role by role. Before machines replace individuals, they change the nature of the work they do.

That is likely to affect job satisfaction. Many employees put a higher premium on non-monetary than monetary rewards. A recent Federal Reserve discussion paper by Katherine Lim and Mike Zabek surveyed American workers who had switched jobs to find out whether and why they thought their new positions were better; they found that interest in the work mattered more to people than pay and benefits.

Which is why another recent paper, from Milena Nikolova and Femke Cnossen of the University of Groningen and Boris Nikolaev of Colorado State University, makes for sobering reading. The authors looked at the prevalence of robots in industrial settings and how that affected workers. Robots reduced the perceived meaningfulness of jobs across the board, irrespective of age, gender, skills and the type of work. In theory, machines can free up time for more interesting tasks; in practice, they seem to have had the opposite effect.

In a separate paper, Ms Nikolova and Ms Cnossen, along with Anthony Lepinteur of the University of Luxembourg, explore why this might be. They find that industrial robots make jobs less physically taxing. But the number of tasks that remain open to humans dwindles, hurting both the variety of work and people’s understanding of the production process. Work becomes more routine, not less.

Machines need not have a dulling effect. In their research Ms Nikolova and her co-authors found that people did not perceive a loss of autonomy if they were working with computers, where they have more control of the machine than the other way round. (Presuming, of course, you can turn it on.) And automation may well have a different impact on service industries like health care, where less time spent on drudge work might indeed mean more time with patients.

A paper from 2011 by Michael Barrett of the University of Cambridge and his co-authors found that the introduction of drug-dispensing robots into hospital pharmacies had disparate effects. Pharmacists felt the quality of their jobs had improved because they had more time for patient counselling. Like the IT administrators rolling back the CrowdStrike update, technicians enjoyed the enhanced status that came with knowing how to fix the robots. Pharmacy assistants had a more miserable time of it, however, as their role shrank to loading medicine into the machines.

Consumer reactions to automation can also vary. An experiment conducted by Eugina Leung, now of Tulane University, and her co-authors tested how customers reacted to different descriptions of a cooking set. People who prided themselves on being skilled chefs really didn’t like products that promised to do everything at the touch of a button. A technology that cuts down on boring tasks is fine; one that threatens your sense of identity is not.

It is still too early to know how AI will affect the quality of work. Some will surely enjoy using a bot to brainstorm ideas and take care of menial tasks. Yet research by Pok Man Tang of the University of Georgia and his co-authors also suggests that workers who interact more with AI assistants feel lonelier and crave more social contact. 

The thing for managers to remember is that machines can make employees feel differently about their work. So it matters whether new technologies are introduced in collaboration with employees or imposed from above, and whether they enhance or sap their sense of competence. Bosses who ignore these issues are missing something meaningful.",9,0.9939
t3_1ec1lye,Machines have often made my job worse even before we started dealing with AI so I can believe it.,3,-0.4767
t3_1ec1lye,"\"Impossible!\" says everyone that has had a job.",-2,0.0
