link_id,body,score,sentiment_score
t3_1ec1ka3,Tesla and spaceX are so fascinating to me in that they act as a Rorschach test of people political biases and blindspots.,1,0.6696
t3_1ec1ka3,Simple. Eliminate all government subsidies for all Tesla EVs vehicles only. Elno says Tesla isn’t a car company so it should be legal. I’d also throw on a Tesla tax for the consumer of 15% of the vehicle cost. It’s beyond time to destroy that entire company.,0,-0.4588
t3_1ec1j4c,Why can't we just have standardized bikes provided by host for this?  That should prevent all sorts of problems.,15,-0.3818
t3_1ec1j4c,Make the motors out of the same materials they made ‘04 ford Taurus motors out of: Plastic. Undetectable!,1,0.0
t3_1ec0pz6,"I'm not a fan of \"AI ALL THE THINGS!\", but this seems like a reasonable use because it's immediately checked by a human.

Will be interesting to see the # of positives/false positives they get with this system.

Since it's being paid for with public funds, hopefully details like that will be made available.",11,0.9584
t3_1ec0pz6,"Las Vegas allows CCW permit holders to carry on public transport, so how is this going to work since it’s not going to be able to discern of a person has a permit or not. Will police be waiting for you with guns drawn at the next stop acting being flagged?",3,-0.296
t3_1ec0pz6,"This is going to be a disaster. They apparently beta tested something similar here in NYC, and it found so many false positives. One lady’s iPad showed as a handgun in her bag. Even though it had obvious massive failure, our idiot mayor is still planning to deploy it system wide….",2,-0.7927
t3_1ec0pz6,R/whatcouldgowrong will have a lot of content,1,0.0
t3_1ec0nq2,"I once saw a calculation how energy contained only in agricultural \"waste\" of all kinds exceeds human energy consumption. But various idiotic approaches have sadly given biomass a bad reputation.",1,-0.9224
t3_1ec0nq2,https://youtu.be/HzHyXnDAXTY?si=JycTvijhMzpnra-a,1,0.0
t3_1ec0nq2,The Mr. Fusion Reactor on my Delorean will gladly take those bananas.,1,0.34
t3_1ec0nle,"The Israeli government took extraordinary measures to frustrate a high-stakes US lawsuit that threatened to reveal closely guarded secrets about one of the world’s most notorious hacking tools, leaked files suggest.

Israeli officials seized documents about Pegasus spyware from its manufacturer, NSO Group, in an effort to prevent the company from being able to comply with demands made by WhatsApp in a US court to hand over information about the invasive technology.",17,-0.8439
t3_1ec0nle,"Pegasus, one of the most powerful \"cyberweapons\" known to the public. It can install spyware onto an iOS device with no user interaction needed.

Fun fact: LastPass is owned by a PE firm (Francisco Partners) that at one point had a majority stake in NSO Group, developer of Pegasus. So, that's who you're trusting your passwords with if you use LastPass.",14,0.7841
t3_1ec0nle,"> Israel’s actions appear to have had a material impact on the case. NSO has argued that its ability to participate in discovery has been limited by various restrictions under Israeli law.

Well then NSO should be banned from countries like the US, and their assets in the US should be seized.",4,0.0516
t3_1ec0nle,And yet the U.S. sends billions to Israel.,0,0.0
t3_1ec0nle,"Not tried, they *did*.",1,0.0
t3_1ec0nle,"is this not blatant, foreign interference?",-1,0.0
t3_1ebzxj2,"Yay, another activist conservative court making up law and rulings to appease corporate interests over precedent and logic. 

I wonder how many gratuities those 9 judges will be getting shortly.",23,0.7579
t3_1ebzxj2,I never understand why does US make such progress but backwards. That and the moral bankruptcy.,8,0.2263
t3_1ebzxj2,All it did was cause everyone’s internet bill to go up. As soon as the economy notices that you have more money available it’ll adjust itself accordingly,-10,0.0
t3_1ebyzf4,China committing espionage?!? Is there any precedent for this?!??!??,4,0.4829
t3_1ebyzf4,"So, it turns out they may have been using someone else's source code without permission. A federal court in California just allowed Beijing Meishe Network Technology to bring copyright infringement and trade dress misappropriation claims against TikTok. And here's the kicker... TikTok's been apparently using Meishe's code for who knows how long! It seems there's a bit of a legal debate going on. There's a 'split in authority' over what legal precedent should govern the claims, so tossing them out would be premature. It's like a digital version of the Wild West!

Edit: I read the case link and it seems Beijing Meishe Network Technology Co., Ltd. (Meishe) filed a complaint against defendants TikTok Inc., TikTok Pte. Ltd., ByteDance Ltd., and ByteDance Inc. (collectively, TikTok) alleging copyright infringement, violation of the Digital Millennium Copyright Act, misappropriation of trade secrets, and Lanham Act false advertising. Meishe is a Chinese company that developed a video and audio editing app and software development kit (SDK) with copyrighted source code. TikTok is a social media platform that allegedly used Meishe's source code without permission in its app and other software, including Faceu, CapCut, Lemon8, 轻颜, and BytePlus Video Editor SDK.

Meishe alleges that TikTok had access to its source code through a former employee, Mr. Jing Xie, who worked for Meishe until June 2015 and began working for TikTok around October 2017. Meishe discovered the infringement in March 2021 and provided TikTok's counsel and experts with a copy of the China copyright registrations and associated material, as well as all asserted Copyrighted Works, including copyrighted registered and unregistered source code files. **Meishe alleges that TikTok's source code contains identical, verbatim portions of Meishe's asserted copyrighted independently-developed source code, including copied typographical errors and source code comments created by Meishe's source code authors. Meishe has identified at least 115 of its source code modules associated with at least 134 TikTok source code modules that contain directly copied code.**

TikTok allegedly incorporated Meishe's Copyrighted Works into its products starting in September 2018 and continues to profit from inducing users to download and use the TikTok app and other Accused Software. TikTok took steps to obfuscate its software code in April 2020 to conceal its infringement. The case is being heard in the United States District Court for the Northern District of California.",2,-0.855
t3_1ebyk53,The Jewish Space Laser… is REAL???????,4736,0.0
t3_1ebyk53,"We've made all those \"space lasers\" jokes when they first revealed that system a couple of years ago. It was the highlight of the showcase they had for Biden when he visited Israel shortly after the War started.",193,-0.128
t3_1ebyk53,"\"LASER\"

-Dr. Evil",569,-0.6597
t3_1ebyk53,I also want one,692,0.0772
t3_1ebyk53,"Oh, god, is this the ‘Jewish space laser beams’ timeline? Does everyone have to wear safety goggles?",637,0.644
t3_1ebyk53,How does it perform with mosquitoes? Can it cover a metropolitan area?,129,0.0
t3_1ebyk53,"\"nearly unstoppable\" how do you even try to fear monger a defense system 😂",172,-0.5423
t3_1ebyk53,"Part 1 of Article

>Israel’s New $1.2 Billion Laser Will Be Nearly Unstoppable—And America Wants One, Too

>This air-defense system never runs out of ammunition and can destroy threats up to 4.3 miles away.

>BY  DAVID HAMBLING

>PUBLISHED: JUL 24, 2024

>Israel had defeated virtually the entire attack, swatting cruise missiles, ballistic missiles ,rockets, and drones from the sky. And that was by design.

>“Israel is a narrow strip of land with dense urban population centers. That does not leave much depth, so there is a premium on intercepting threats in flight,” explains James Black, assistant director at RAND Europe, a nonprofit think tank. But Israel’s sophisticated, multi-layered integrated air-defense systems couldn’t stop everything. Nine Iranian missiles reportedly struck Nevatim and Ramon Airbases, and one person was injured by shrapnel. The waves of drones, missiles, and rockets synchronized to hit simultaneously were meant to overload Israeli defenses and exhaust stocks of interceptors. The wall held well this time, but Israeli planners know it’s a numbers game.

>“Looking at both Israel and Ukraine, we are seeing defenders burning through missiles faster than industry can replace them,” Black says. So, Israel wants an air-defense system that never runs out of ammunition: Iron Beam.

>A $1.2 billion U.S. aid package will help fund deployment of Iron Beam, Israel’s one-of-a-kind, high-power laser system designed to knock down missiles, rockets, and drones. It’s a big bet on unproven technology—but success would yield an almost invincible defensive shield. Assuming all goes to plan, Iron Beam will be a lifesaver for the Israelis, who suffer regular aerial attacks. Yemen’s Houthi Rebels alone have lobbed more than 220 kamikaze drones and missiles at Israel since the war with Hamas broke out in October 2023. And then there is Iran and Hezbollah, of course. As weapons proliferate and ranges increase, America could one day face the same problem—but lasers could solve that issue at the speed of light.

>OFFICIALLY KNOWN AS “SHIELD OF LIGHT,” Iron Beam is a 100 kilowatt-class High-Energy Laser Weapon System, which Rafael Advanced Defense Systems first unveiled in2014. Rafael is also a contractor on Iron Dome. “Iron Beam will not replace Iron Dome, but complement it. Directed Energy offers a way to prioritize kinetic interceptors against the threats they are most needed for,” Black says. Specifically, Iron Beam will be integrated as an additional short-range layer to destroy threats up to 4.3 miles away.

>Unlike missiles, Iron Beam can keep firing as long as it has power.

>“Much of the interest in lasers stems from the magazine depth they offer,” Black says.“ This is not quite infinite—parts and energy supplies do not last forever—but they do give a very deep magazine compared to batteries of missiles.”

>Another important aspect is the cost per intercept. One Iron Dome interceptor missile costs $40,000–$50,000, according to Israel’s Institute for National Security Studies. While cruise missiles can run to millions of dollars, Iran’s long-range Shahed-136 drones are simple, low-tech machines costing less than $30,000 apiece. Hamas mainly relies on Qassam home-made rockets, assembled from industrial pipes and improvised explosives, costing less than $1,000 each.",90,-0.9467
t3_1ebyk53,Is this the “Jewish Space Laser” Marjorie Taylor Green said caused wildfires? **/s**,117,0.0
t3_1ebyk53,YES! Finally we get friggin laser beams! Someone round up some sharks. We've got work to do!!!!,144,0.6809
t3_1ebyk53,We are living in a meme,40,0.0
t3_1ebyk53,"Israel had been working on this for years. It's a short-range weapon, meant to supplement and not replace the Iron Dome system. It has shorter range is limited by things like fog, dust or rain. However, it's much cheaper to operate.

Israel isn't the only state working on laser system: the UK had began testing similar system in the last few months; the US navy had been experimenting with lasers for years now.

It seems likely that Israel's system will be the first to see combat, for the simple reason that Israel is under constant attack by terrorists using cheap, small UAVs.

Ukraine could also use such a system; however, Ukraine is much larger than Israel, and the short-range nature of laser systems will require a huge number of units (same problem with their use of an Iron Dome or similar system).",289,-0.8834
t3_1ebyk53,Most people don't seem to read the articles. But when it's behind a paywall you can guarantee no one did lol.,23,0.5267
t3_1ebyk53,"America has one, we just don’t talk about it.",13,0.0
t3_1ebyk53,is it going to be... in space?,24,0.0
t3_1ebyk53,Nearly unstoppable is a massive overstatement.,13,-0.4404
t3_1ebyk53,can we fit it onto sharks?,9,0.3612
t3_1ebyk53,I'm just here for the space laser jokes.,9,0.25
t3_1ebyk53,The problem is that volume of missiles can overwhelm lasers if you don’t have enough of them just like any missile defense system. Lasers have gigantic batteries often hooked up to them that if depleted requires a power truck to bring back.,8,-0.1027
t3_1ebyk53,Who the hell do they think is paying for it? The US Taxpayer.,19,-0.6808
t3_1ebyk53,"A lot of people saying \"oh no spaz lazr lmao\" I think didn't read the article. It seems to just be yet another extension of Israel's \"Iron Dome\". Another land-to-air defense measure that could be more efficient at the task than previous measures, in theory.

The weapon would complement the already existing system rather than replace it.",7,0.624
t3_1ebyk53,Sharks with frickin lazerrrr beamssss,8,0.0
t3_1ebyk53,"\"Quick, get to the House of Mirrors\"",4,0.0
t3_1ebyk53,How soon before we can buy one for $12.99 from Temu?,3,0.0
t3_1ebyk53,"DoD has been working on something like this for many years. I remember hearing 10 or so years ago they were trying to create a plane that could support the weight of a laser, and then use the realtime flight data to calculate with the laser the proper angles etc. to be able to shoot missiles out of the sky. So ideally to defend the coast they have these planes flying around and can shoot down incoming missiles several miles off the coast. No idea what happened to it since the person I knew at the time changed jobs.",5,0.5256
t3_1ebyk53,"I remember reading something somewhere on how dangerous these are to anybody in the vicinity, even if you're shooting at extremely far off targets. You fire one of these bad boys and a bird flies through the beam, anybody looking in that direction gets their eyes permanently damaged.

Going to need to mandate that everybody in the vicinity have high end laser glasses on at all times.",14,-0.8979
t3_1ebyk53,Because Popular Mechanics has always been a dependable source for what’s to come/s,6,0.4215
t3_1ebyk53,https://www.concordaerospace.com/products/jewish-space-laser-activation-panels-customized,4,0.0
t3_1ebyk53,Can we mount this on a shark’s forehead?,2,0.0
t3_1ebyk53,"Wow, that's pretty cool actually. Biggest hurdle will come down to energy use instead of rocket materials used for Iron Dome.",2,0.886
t3_1ebyk53,Unstoppable.... Unless there's a power outage. ,2,0.0
t3_1ebyk53,Nearly unstoppable like the Iron Dome? Or the Merkava tanks?,2,0.264
t3_1ebyk53,"I just looked up on amazon, a 2 inch 4000 mirrors **corner cube reflector** that would blind/disrupt/damage the targeting sensors on the laser costs cca $10, It has a central mounting screw, perfect for just screwing it on the underside of a drone ....  
The reflector would not protect the drone , but for sure it would cause a problem on the laser end of the business .

Extraordinary claims require extraordinary proof....",0,-0.0366
t3_1ebyk53,"Its good to see, can be helpful for anti drones too.

Rolls royce, leonardo and a few other ones have similar projects with darpa/usa or uk mods etc.

Lasers may end up being the ultimate anti-war too of the next century in terms of shooting down missiles, dumb bombs and drones.

Then scaling down (solid state batteries would help) for tank defense or other vehicles against drones.",1,0.1531
t3_1ebyk53,Perfect for killing children,-14,-0.1779
t3_1ebyk53,"What if instead, we provided free school lunches and maybe breakfast for children in need? Maybe we provide healthcare first?",-9,0.5661
t3_1ebyk53,"War criminals get more toys to kill more innocent civilians, how fun",-17,-0.8211
t3_1ebyk53,Lasers never run out..:we can start an intergalactic war ten light years away!,1,-0.636
t3_1ebyk53,Cool.  Cur off their defense spending till we get the specs.,-13,0.4215
t3_1ebyk53,If only it could be pointed directly at Netanyahu,-11,0.0
t3_1ebyk53,[removed],-12,0.0
t3_1ebyk53,"Woah a war crimes laser! They can melt an entire \"Hamas\" family from 120 miles away!",-18,-0.6688
t3_1ebyk53,"Great, now all the missles will be mirror covered.",-3,0.6249
t3_1ebyk53,[deleted],-4,0.0
t3_1ebyk53,What a massive waste of money Christ,-21,-0.4215
t3_1ebyk53,We've had lasers for like a decade now.. why are people just realizing the DEW are real?,1,0.3612
t3_1ebyk53,[removed],-27,0.0
t3_1ebyk53,No more ICBMs—now it’ll be DBBMs (Disco Ball Ballistic Missiles),-1,-0.296
t3_1ebyk53,[deleted],-4,0.0
t3_1ebyk53,Not if we jam it!,-14,0.0
t3_1ebyk53,Vanta black would like a word,-15,0.3612
t3_1ebyd3x,"Will you be researching into other social platforms?

VR may not be *that* active, however in VR Social games/applications, there have been a growing issue of similar. I don't think a month, if not a week, goes by I over hear about questionable people in VRChat. There are youtube videos, granted some to most are parodies, To Catch A Predator-style situations in VR.

Sure, there's hardly any Text, it's pretty much all voice. Many people use voice synthesizers to be older/younger or the other gender.

It's not just Predators, VRChat is meant for 13+, there are young teens who are clearly not mature enough for their age on VR (in turn suspected to actually be under 13 in a lot of cases), and many who are actually under 13. There's very little action discussed about these issues, and very little one can do to report underage related issues. Because of all the maturity issues, many regular VR users are pushing for VRChat, and others like it, to be 18+.

Mind you, VR social platforms don't require a VR headset, you can play at your desktop.",50,0.797
t3_1ebyd3x,"Does Roblox require it's T&S staff to have any T&S related qualifications or accreditation? How many of the moderation staff employed by Roblox work on T&S roles and do the T&S staff cover the range of languages that Roblox supports?

In your research for this story, did you become aware of Yubo Kou and Xinning Gui's 2023 paper, *Harmful Design in the Metaverse and How to Mitigate it: A Case Study of User-Generated Virtual Worlds on Roblox*? If so, have you reached out to them for comment and/or further information?

Have you communicated with anybody from the FCC or FTC in relation to this story?",28,0.6278
t3_1ebyd3x,I know you're talking about like child abuse type predators but the entire existence of Roblox is predatory. The whole business model is getting kids to program experiences that rip off IP to create revenue and then [radically underpay them for their work](https://www.giantbomb.com/roblox/3030-25462/forums/eurogamer-presses-roblox-head-about-exploiting-chi-1919395/). That company lacks a moral compass so hard I think if they thought they were making money off child predators they'd be cool with it.,45,0.3508
t3_1ebyd3x,I have chat turned off for my kids and set to All Ages experience. What else can I do from a safety standpoint? ,18,0.4215
t3_1ebyd3x,"My kids and I play Roblox together. It is a lot of fun to game with them. I don’t think I would play if it wasn’t for them as it’s obviously geared towards kids (even so, some games can be a little addicting even for a grown up).

I haven’t encountered any grooming or predators or anything explicit. I’m guessing a lot of this goes on in private chats or using other chat programs like discord. 

Any point of communication presents a risk. Parents can point their fingers all they want, but the responsibility to teach their children the dangers of interacting with others, especially adults, resides with them.

Also for a company, monitoring chat dialogue can consume substantial resources. Roblox does have a chat filter in place, which is a big advantage. I think and hope that AI will quickly develop to help monitor and identify these types of predatory behavior.",7,0.8705
t3_1ebyd3x,"You covered this story from an astonishing number of angles. I was continually impressed by the number of different people you talked to and got quotes from as I read the article. It's something not really seen in today's gaming media landscape of rumors and leaks.

What's your process for seeking people for a story and how do you pitch yourselves as someone they can trust to talk to on or off the record?",5,0.7906
t3_1ebyd3x,"I’m no fan of Roblox.

But to what extent do you think child safety is hampered by the Children’s Online Privacy Protection Act, in the U.S.?

There are measures designed to protect children - such as  not requiring an email address or phone number to create an account.

But these same measures are exploited by predators, who can act with complete anonymity if they claim they are under 13.

Defenders of Roblox have blamed U.S. legislation - is this fair?",4,0.7467
t3_1ebyd3x,"I used to work as an intelligence analyst with detectives handling reports about Roblox circa 2018/2019. It's always been incredible to me that they haven't been shut down yet. I think with AI/ML there are a lot more opportunities to automate the process, I know you mention they are trying that in the article, and hopefully, this article puts some more pressure on them. 

In my humble opinion, these gaming companies need to have fully funded and permanent teams that monitor this chat activity and work with law enforcement to quickly take action in the same way financial companies must have AML teams and KYC policies in place to counter money laundering and fraud. It shouldn't rely on the proactive goodwill of companies to comply there needs to be regulation that drives this.",4,0.8842
t3_1ebyd3x,How can unregulated chat stay on games for kids? For example in a game called Heroes of the Storm by Microsoft there is a constant general chat spewing hate speech and pedophilia talking points. How can it remain there if when you log in that is the first and only thing you see on the chat menu? How is that legal?,9,0.163
t3_1ebyd3x,"Now that this investigation into Roblox has concluded, do the two of you plan on investing more time and research into other topics involving children and the video game industry? 

One such topic I've always had on the back of my mind is the effect microtransactions can have on the youth of today. More specifically, those involving rng and luck could be compared to that of a casino. Even sports video games, a market that is easily accessible to children because these games are rated for all audiences, have game modes particularly built around customers spending money to \"gamble\" on getting better players.",2,0.8074
t3_1ebyd3x,Do you feel parents have any responsibility to stay aware of the actions of their young children?,3,0.0
t3_1ebyd3x,Why do YouTubers and twitch gamers like kids so much?,3,0.3612
t3_1ebyd3x,Have you thought about a future investigation into a lot of the unpaid work that kids do in the games they make? It's a seriously rampant problem with no way to stop it.,1,-0.7783
t3_1ebyd3x,"As someone with lived experience with this, props to you for your work, I know CSA aren’t the easiest things to deal with, but your work will hopefully help future kids. Do you have any games you’re thinking of looking into next?",1,0.8402
t3_1ebyd3x,Would you let your own children play Roblox after everything you’ve learned?,1,0.34
t3_1ebyd3x,"Hey Cecilia, always wild to see your work in the wild. Keep at it.

-someone you’ve known since HS (due to a mutually terrible person)",1,-0.4767
t3_1ebyd3x,The new voice chat adds more of a dangerous precedent for pedohpiles as they’re creating games that imply “bars” and “clubs”. What’s stopping a child from taking their parents ID and gaining access to voice chat? What’s the process behind that? How can they verify other than simply by putting in your birthday that a user is in fact the required age for voice chat?,1,0.1435
t3_1ebyd3x,I'd play with children on Little Big Planet all the time and I'd disable all the features that would let them talk to me or friend me or anything else like that they could do. I'd even block them.,0,0.6369
t3_1eby8ag,I miss antitrust cases. This feels like it needs one.,193,0.2263
t3_1eby8ag,"This is pathetic. Google made its own search engine unusable with its promotion of SEO bullshit, so now that they’ve decided to lock up one of the only useful sources for information that isn’t regurgitated AI crap.",333,-0.802
t3_1eby8ag,Reddit should be paying us per post.,23,0.0
t3_1eby8ag,"\"After Reddit declared war on free use of ***its content*** for AI training...\"

The content on Reddit isn't Reddit's.",85,-0.1531
t3_1eby8ag,"I mean, okay.

Recent reddit results are garbage. I try to look for modern quality denim brands and the \"last year\" posts are shit and clearly astroturfed by bots and bought accounts.

It's amazing how quickly it went from \"add reddit to the end of your search\" to \"and also only trust things from ~2022 prior\"",4,0.7964
t3_1eby8ag,[deleted],9,0.0
t3_1eby8ag,"Isn't the idea to drive traffic to a website?
But then again, Google is pretty much 99% of search traffic",2,0.6486
t3_1eby8ag,"how ironic, article on ars technica owned by Conde Nast, which also owns reddit.",2,-0.128
t3_1eby8ag,"I've switched over to Kagi, so I'm glad to hear it's not impacted by this.",3,0.507
t3_1eby8ag,"We create the content of reddit, literally without the free effort of the users, mods, etc this site would collapse.  I refuse to use google, even though its better and I have noticed the lack of reddit search results.",1,-0.6599
t3_1eby8ag,And nothing of value was lost.,1,-0.5165
t3_1eby8ag,"\"**Don't be evil**\" is [Google](https://en.wikipedia.org/wiki/Google)'s former [motto](https://en.wikipedia.org/wiki/Motto),",-8,0.0
t3_1eby8ag,"I use Startpage and still get plentiful Reddit results even without adding the site conditioner. However, fuck Google.",-9,-0.5423
