link_id,body,score,sentiment_score
t3_1ebwx5n,"Companies have wanted to commoditize tech since its inception, and some aspects have. For example, Linux has commoditized servers, and the Cloud has commoditized computing. Once bright, well-educated engineers are commoditized, companies can treat them like Linux servers. While that may be long away, things like AI may help bring that into the present much more quickly.",1,0.9062
t3_1ebwx5n,"Lack of good management… imported talent for low pay, poor output!!",1,-0.4184
t3_1ebwx5n,"Anybody can be replaced, but not everyone can be replaced by just anyone",1,0.0
t3_1ebwx5n,This website was a fucking nightmare to use on mobile,1,0.0
t3_1ebwx5n,"2008, what is your job function and why do you matter, oh nevermind we don't actually care we have to pay everyone off so the executive suite can get a golden parachute with whatever is left over",1,-0.4456
t3_1ebwx5n,"Profits over people and managers don't fire themselves. They just hunt for cheaper or outsourced labor.

So many companies have too much pork in the middle and only periodically thin that layer.",1,0.6041
t3_1ebwx5n,Because when they’re already working from home there’s no need to fire them before sending them there. Just a guess tldr,1,-0.5574
t3_1ebwx5n,"Labor laws, mostly",1,0.0
t3_1ebwx5n,"I like these articles and peoples anecdotes of trying to comfort themselves because they cant land a high paying remote job while the journalist writing the piece is simultaneously looking for another job because their sad existence is coming to an end due to years of a crumbling industry and lacking of ethical standards. 
Its almost poetic. ",1,0.6369
t3_1ebwx5n,"These days?!!?!??!??!  

BwahahahahahahahahahahahahahahahahahahahHhHhHHahgahahahahHhGgGa

Omfg

We are doomed!

Fuck me. Talk to me when I was working a call center that had a list of employees ready to go at the fly.

I was given a list of 40 staff to term asap. We were 'overstaffed'. 

My experience is not limited to the call centers.

When the numbers must go up, they'll find a way.",1,-0.8254
t3_1ebwx5n,have they considered that tech managers might be smarter than someone who put hand dish soap in their dishwasher,1,0.7351
t3_1ebwx5n,Right to work is a sham,-3,0.0
t3_1ebwx5n,The tech sector overhired during the pandemic and spent the last 2 years correcting itself,0,0.0
t3_1ebwx5n,"IT people get fired/let go more than people in sales because IT is a cost center, sales are a profit center. That cuts across industries.

Want job security? Go into a field that's performance-based, not one where you're instantly a commodity.",-2,0.5267
t3_1ebwx5n,"Well, these days kids come out of the womb computer literate with the innate ability to program .  With such a huge supply, why not fire tech employees just when tenure is around the corner or just before they are to retire or get a huge promotion with a huge raise.  Fuck tech companies.",-6,0.7805
t3_1ebwesr,next news - there is a massive traffic jam bc cars are stuck due to crowdstrike,375,-0.25
t3_1ebwesr,All I can tell you is that our 12 yo Prius needs a Map Update and we can't afford it.,83,0.0
t3_1ebwesr,"It's like the change to all digital dashboards. Want to set the AC? Take your eyes off the road to go into 3 different menus... Older cars, just press a button or turn a knob.

Sometimes technology just makes life worse instead of better.",200,0.3818
t3_1ebwesr,"My bets are not for long, to make you buy newer models",33,0.0
t3_1ebwesr,"Why do they need updates? How many Windows updates have we had that stopped something from working? It's even worse in a Tesla.

I had a Tesla for two years. The updates severely reduced the functionality of the vehicle, introducing phantom braking and reducing the functionality of windshield wipers, lane-keeping, and cruise control. They altered the user interface without warning or explanation. They even completely and permanently disabled the radar proximity detection because they decided to omit that feature in newer cars.",60,-0.7449
t3_1ebwesr,I can’t wait to get fired because an update bricked my car overnight 😂,9,-0.5574
t3_1ebwesr,They can say. They won’t say.,7,0.0
t3_1ebwesr,I think I'm just going to keep driving my 2000 Camry until I die.,8,-0.5994
t3_1ebwesr,"Modern cars are a disaster. I work in collision repair and they have become such a nightmare to repair and keep programmed. Even something that should be simple, like a door handle, is often co trolled by servos and computers when it just needed to be a fucking door handle that opens the latch. It’s all gotten so stupid and hilariously expensive to fix. Not to mention much less ergonomic. And the absolute disappearance of mechanical shifters is a disgrace. Every brand has different layouts of their new push button or dial shifters, and will do all sorts of dumb shit like apply parking brakes or lock the shifter until you are fully seated with the doors shut and seatbelt on. And the disappearance of control knobs has been a disgrace. Now instead of turning a dial to control functions, you have to use clunky and shitty UI touch screens or at best, directional switches. Nothing like pressing a button 35 times to go from hot to cold on your climate control… and the beeping. They beep about everything. And people are happy about it! They want to be coddled by their appliance on wheels instead of actually taking responsibility and paying attention when they drive. No wonder crashes and fatalities are at an all time high.",17,-0.9615
t3_1ebwesr,"Everything seems to get less reliable and more flimsy as time moves ahead. 

Some comedian once joked that we've gone from cave carvings/drawings that last thousands of years to putting the sum of human knowledge on disks that can be wiped out with a fridge magnet.",19,0.5994
t3_1ebwesr,Jailbreak the ECU,14,0.0
t3_1ebwesr,"Can’t wait to buy my Sonos EV, lol.",5,0.4215
t3_1ebwesr,Buy old cars,4,0.0
t3_1ebwesr,"I’m sorry Sir, the software for your $200k car is no longer supported, so there’s no possible way you can drive it any longer.",9,-0.34
t3_1ebwesr,Commercial trucks have had multiple computer systems in them since the 90s. When I plug into one I can update it but rarely need to. It’s been working for 25 years why mess with it unless there is an actual problem.,8,-0.7783
t3_1ebwesr,"Honestly...I don't want them. 

I can't tell you how many times I've had problems with an old something or other, when the company pushes updates. Many of which install automatically.",6,-0.4445
t3_1ebwesr,"It's almost like this [Snopes article](https://www.snopes.com/fact-check/car-balk/) on a debunked urban legend about the automotive industry stance on computers rendered true.

https://www.snopes.com/fact-check/car-balk/",3,0.6133
t3_1ebwesr,"As long as they aren't connected to a network, they never need to get an update.",3,0.0
t3_1ebwesr,"The EU now requires that new cars will be connected, have telemetry \"in case of accidents\" and be able to receive OTA firmware updates. I call this anti-consumer bullshit:

* Telemetry data is very valuable to insurance companies, which will use this data to increase insurance premiums: \"you've driven 3 kph over the speed limit; you're a reckless driver and we raise your premium 30%\". It's also very valuable to ad-pushers, who will be able to target drivers with geo-located ads.
* OTA firmware updates: do you know what's the best way to keep a computer secure? that's right, keep it off the Internet. Once a computer (your PC, a server, your car's engine-management system) is connected to the Internet, criminals and bored script kiddies will keep poking it for security holes *and find them*.
* There's an additional reason, barely mentioned but which makes car-makers drool with greed: subscription services. You want to make a bean-counter cum? whisper in his ear \"recurring revenue stream\".

The golden age of cars was the decade between 2005 and 2015: car technology was good enough to make safe, fast, reliable and fuel-efficient. All the useless electronic crap they've been adding is a clear case of enshittifaction.",3,0.5428
t3_1ebwesr,"Sweet now cars are done for every 5 years because they will stop security updates. 

Absolutely brilliant lads, so much fuckin extra waste now. 

They will reduce it over time too, 3 years with security updates. 5k a year after that. 

Gotta keep consumers consuming. 

Not like the world is going to shit or anything or a global crisis hanging over our heads...nope its clean sailing. 

We are so fucked.",6,-0.7804
t3_1ebwesr,"The question I have is warranty work. 

What happens if/when an update bricks the vehicle that requires physical access to the car to fix/reprogram?

At some point, the manufacturer should be taking responsibility of these updates.",4,0.0
t3_1ebwesr,"They don't update for anything that isn't mandated by NTSB unless it is to gather more data from your car to sell once you own the car.

One other reason would be to decrease performance to reduce warranty claims.",4,0.0
t3_1ebwesr,"Sweet now cars are done for every 5 years because they will stop security updates. 

Absolutely brilliant lads, so much fuckin extra waste now. 

They will reduce it over time too, 3 years with security updates. 5k a year after that. 

Gotta keep consumers consuming. 

Not like the world is going to shit or anything or a global crisis hanging over our heads...nope its clean sailing. 

We are so fucked.",4,-0.7804
t3_1ebwesr,Another interesting question is will the manufacturers be liable for repairs needed due to updates breaking things on cars that no longer have a warranty.,2,0.128
t3_1ebwesr,"If it's like any other software or firmware update, my question isn't \"how long will the manufacturer push updates\", it's \"how do I disconnect from the network so the manufacturer can't push a breaking change onto my working, paid-for device?\"",2,0.3612
t3_1ebwesr,"A more important question is why are we, as a population, allowing such shit changes? Where are the protests about the insane amount of waste this will create, the damage to the environment when every 5-10 years you'll need to get a new car cause the Electric vehicle you just got is no longer supported due to outdated software?",2,-0.8825
t3_1ebwesr,"Call me crazy but all I need is a car that drives me from point A to B.  I don't want a touch screen, I don't need self driving, I don't need annoying beeps and whistles telling me there are cars nearby, I don't even really need air conditioning if we're getting down to brass tacks.

If the foundation of the auto industry in 2024 is built on including mandatory fluff that inflates the price of what should be a simple tool then it is doomed to fail.",2,-0.8819
t3_1ebwesr,My Land Rover is at the dealership due to software issues. My bill was $350 just to get it in the door.,2,0.0
t3_1ebwesr,"Almost every update my 2016/17 Prius has gotten has just removed features. 


Every few months it would update and I would lose an app like Pandora radio or a app to buy movie tickets lol. 


Only had one update that added something and all it was was a shitty version of Amazon Alexa that soft locked the whole UI dashboard until I turned my car off and on. Really sucked when I was trying to find the exit I needed on a 75 MPH highway and I accidentally switched to Alexa.",2,-0.7178
t3_1ebwesr,My Sony Bravia just sunset the Netflix app yesterday because of “technical limitations”. And you know auto makers would love to make cars just stop working at 5-10 years. ,2,0.4588
t3_1ebwesr,"Consumer protection laws for most electronics in the US require manufacturers to provide support for five years from the last date of manufacture if I remember correctly. Outside of that time frame typically things like replacement parts and updates are no longer provided. I could be mistaken or entirely off base considering auto makers could be regulated differently, but I won’t expect them to go above and beyond the minimum required by law regardless.",2,0.0644
t3_1ebwesr,I love my 2006 Colorado.,2,0.6369
t3_1ebwesr,"It will be interesting to see how this shifts liability from drivers to manufacturers. Are the manufacturers ready for it?

“Because you (Car Co) failed to update your software or you disabled subscription capabilities or you failed to alert me of car issues - you are responsible for any damages.”

This isn’t far fetched it’s already something with airlines and how GE maintains ownership of the engine and charges for maintenance etc.",2,-0.2023
t3_1ebwesr,"Automakers should be FORCED to provide updates.

I'd take it even further - automakers should be FORCED to provide technological upgrades. Back in the day, we could change the head unit, because practically all of them were 1DIN or 2DIN. Nowaday, you can do fuck all. They should make them upgradeable, and (even if through the dealer) let the customers buy new hardware for the infotainment systems. After all, it's all just computers. Shouldn't be that hard to figure it out some modularity.",2,-0.8927
t3_1ebwesr,"It's worse actually, they already start shutting down online services required for essential functionality in recent cars:

Merceds anounced shutdown of online services for \"older\" cars by end of 2024, including those of electric Smart EQ (pre sale of smart to Geely). Cars build as recent as march (?) 2024, will be offline after that. No more charger status, no more climate boster, etc. Pretty essential features for a electric car, especially with a small battery.

Many other IoT companies also start to realize that maintaining already sold products, or the requried online servies for it, does not make much money and they can't push paid cloud services on people as much as they probably hoped.

A lot of devices bought in recent years will die, or become at least partially useless, because of this.

Not a big issue for a 50$ gimmic, but a fucking big deal on purchase like a car, or smart home setup for the whole house.",3,0.6617
t3_1ebwesr,Why would anyone in their right mind buy a car made after 2010?,6,0.0
t3_1ebwesr,I think it will tip the scales in right to repair discussions.,3,0.0
t3_1ebwesr,I'm still waiting for the update on my 2013 subaru. So that i stop getting Notifications over my backup camera.,1,-0.3566
t3_1ebwesr,"Ore importantly, how long before a mass BSOD event?",1,-0.3885
t3_1ebwesr,Don’t be surprised when your car isn’t your car even after paying for it,1,0.2263
t3_1ebwesr,Bout to buy a ‘99 corolla,1,0.0
t3_1ebwesr,"Just don't buy any cars that connect to the internet.  Then the updates don't matter.  It's like people complaining about how many ports macbooks have taken away over the years, just stop buying if you don't like it.  There are always other options",1,-0.7426
t3_1ebwesr,Teslas that are 11 years old still get them. It will remain to be seen how long until updates stop.,1,-0.296
t3_1ebwesr,My car is from 2016 and has a computer with the basic stuff but to update the stuff I need a software(easy to pirate but a bit risky in 70k car) on an SD card that cost 200 bucks a year. My gps at this point shows me plowing through fields and lakes. But it has bluetooth that works indefinitely so I guess I'm fine but I can just imagine all the features in modern cars that require regular updates.,1,0.1016
t3_1ebwesr,"Only 1 company that is not from China can do this

1",1,0.0
t3_1ebwesr,All it takes is one bug and these cars wouldn't be able to function anymore,1,0.0
t3_1ebwesr,We have a Toyota with maps via Scout Link that Toyota recently killed. Now the head unit is only good for playing music.,1,-0.2023
t3_1ebwesr,"Same as computers. Until the car makers find it no longer financially advantageous to do so.

Both in terms of substitution effect (companies don't want to compete with their own old used equipment) and the high cost of maintaining software updates that have to be tested on increasingly large numbers of older configurations.",1,0.0201
t3_1ebwesr,“So how long will they get updates” solid title,1,0.1531
t3_1ebwesr,"“Man, I just got this Ford 13, and now they dropped the ford 14s?!  I bet the charging cables won’t even the the same…”",1,0.0
t3_1ebwesr,Updates if its as often as they update the entertainment system that would be never.,1,0.4215
t3_1ebwesr,That’s why I drive a 97 Tacoma and will till the day I or she dies. Likely me first.,1,0.0
t3_1ebwesr,I will try hard to keep buying cars made around 2010. This is getting downright ludicrous.,1,-0.4404
t3_1ebwesr,"Don't expect used cars to retain their value like they used to.  No one's looking to buy an iPhone X, no matter how good of a deal they find.",1,0.5423
t3_1ebwesr,not to worry mod community got this just like smartphones,1,0.6002
t3_1ebwesr,"How long before you can jailbreak it, is the real question…",1,0.0
t3_1ebwesr,"they are also un-opt-outable spyware.  think I'll stick with my 2016,. thanks.",1,0.4404
t3_1ebwesr,"None, unless there is a problem",1,-0.4019
t3_1ebwesr,That’s why I bought a Tesla. We get updates about once a month.,1,0.0
t3_1ebwesr,"Yeah, I’ll stick to my human powered bicycle.  Seems to me that if the car needs software upgrades means your vehicle is subject to hacking.",0,0.296
t3_1ebwesr,"Don't worry, the average online commenter will tell you how dare you use a phone/car/computer that's older than 5 years old, it's totally acceptable for a manufacturer to just decide that you don't own something anymore.",0,0.6122
t3_1ebwesr,"I think it's also important to note that while getting updates is great, you don't actually need them. If you jump in a Tesla that's been sitting since 2018 running that software version, nothing bad happens. Just like running Windows 2003 on your servers. It's fine as long as you don't want anything new.",-5,0.8963
t3_1ebwesr,Cars have been getting updates for a long time. What even is this article ,-4,0.0
t3_1ebwdpl,Blizzards culture has been toxic for years. Now they're under the Microsoft umbrella im so glad to hear some positive news for that workforce.,50,0.816
t3_1ebwdpl,Good for them.,26,0.4404
t3_1ebwdpl,maybe now I can get help finding mankrik's wife.,6,0.4019
t3_1ebwdpl,"LOK’TAR!

(This means “victory” in Orcish and is the only Orcish I know besides “Kek” and “Zug-zug.”)",10,0.0
t3_1ebwdpl,Maybe we all should pay a subscription to fund a super union that would fight for our rights in all jobs. Normally that would be called taxes and elected officials but that ain’t working out.,3,0.1154
t3_1ebwdpl,Shouldn't they be forming a guild instead?,3,0.0
t3_1ebwdpl,"It took me a minute to process this headline, but I’m 100% for it.",5,0.0
t3_1ebwdpl,“Microsoft’s World of Warcraft” makes me sad to read.,2,-0.4767
t3_1ebwdpl,"As long as they stop with the frat boy misogyny and hostile work environment, good for them.",1,-0.2263
t3_1ebwdpl,"Time is money, friend",1,0.4939
t3_1ebwdpl,Work of Workraft,1,0.0
t3_1ebwdpl,wow this game is still active?,-1,0.7579
t3_1ebwdpl,"I wonder how many of them Microsoft will replace with AI?

[https://www.wired.com/story/ai-is-already-taking-jobs-in-the-video-game-industry/](https://www.wired.com/story/ai-is-already-taking-jobs-in-the-video-game-industry/)",-4,0.0
t3_1ebw1d1,"\"Enhance\" is a strange way of saying \"eliminate\".",11,-0.2023
t3_1ebw1d1,"Company looking to profit from AI says most employees could use AI.

Shocking.",4,0.0516
t3_1ebw1d1,"AI's potential to enhance jobs could lead to economic growth, but we need policies in place to protect workers.",3,0.6369
t3_1ebw1d1,"I doubt that as AI progresses, many jobs will no longer require people to do them. Companies will use AI extensively to cut costs, but the question is, if everyone loses their jobs or buying power, who will buy the goods and services produced by these corporations? It's a vicious cycle. We need to wait and see or navigate this wave intelligently.",1,-0.6249
t3_1ebw1d1,Are there people that want A.I in any form?,1,0.0772
t3_1ebw1d1,"Contrary to popular belief, “Enhance” does not mean “eliminate”

Unless talking about cheap fiver jobs, which British are not doing. Anyone utlizing AI professionally or trying commercially can confirm. Exceptions are not norms.

Now the game is to see how long this paranoia lasts, gotta start shorting at the dawn of it.

Edit: english",-6,0.1406
t3_1ebvbuu,Coming soon: Super Super Bugs.,3075,0.8316
t3_1ebvbuu,"I'm an infectious disease pharmacist. This is kinda nonsense lol. Basically they're taking two common antibiotics and putting them together. Macrolides and fluoroquinolones. The idea being that they have different targets so it would be hard to mutate at both sites at the same time. Unfortunately, resistance to each of those sites already is pretty common, so then you're just left using one drug, so resistance could arise just as easily. Secondly, both of these targets are inside the cell, so if bacteria have an efflux pump that just removes the drug from the cell, it'll be resistant. This is click bait nonsense.",715,0.13
t3_1ebvbuu,"Until, of course, it isn't.",897,0.0
t3_1ebvbuu,"Life, uh, finds a way.",363,0.0
t3_1ebvbuu,Oof IFLS. Once a great Facebook page for fun science facts is now a website that exaggerates and misleads scientific findings and phenomenon.,143,0.7783
t3_1ebvbuu,"From the article it sounds like the bacteria has to succeed two dice throws to survive instead of just one? That certainly reduces the chances, but I don't really buy that it makes it resistance proof.",47,0.6059
t3_1ebvbuu,"If you make something superbug-proof, someone will just make a better superbug",26,0.4404
t3_1ebvbuu,Hello super-duper-bugs,5,0.0
t3_1ebvbuu,"”Virtually resistance-proof\"...until it's not.",18,0.0
t3_1ebvbuu,Have we learned nothing from the “unsinkable” Titanic?,23,0.0
t3_1ebvbuu,"Pharma: I triple dog dare these superbugs to beat this!

Superbugs: ok

Pharma: ***shocked pikachu face***",4,0.3595
t3_1ebvbuu,"\"Virtually resistance-proof\"

Uh-oh.",6,0.0
t3_1ebvbuu,That what I look for in a good epidemiologist...hubris.,5,0.4404
t3_1ebvbuu,Who’s going to be holding MRSA beer?,4,0.0
t3_1ebvbuu,It's fire. It's called fire,10,-0.5859
t3_1ebvbuu,This is how almost every zombie movie starts,3,0.0
t3_1ebvbuu,That title is stupid and encourages a stupid pattern of thinking,3,-0.5994
t3_1ebvbuu,Uber bugs inbound,3,0.0
t3_1ebvbuu,New report out of Florida: Cocaine Bugs,3,0.0
t3_1ebvbuu,“ life finds a way”,3,0.0
t3_1ebvbuu,Hyperbugs otw,3,0.0
t3_1ebvbuu,Do you want super Duper bugs because this is how you get super Duper bugs.,3,0.8442
t3_1ebvbuu,"Cpt. Tripps is inevitable idc how resistant they become. 

(For legal reasons, this is a joke)",3,0.128
t3_1ebvbuu,"New Antibiotic Is Virtually Resistance-Proof, for now!",3,0.0
t3_1ebvbuu,"Life, uh, finds a way.",3,0.0
t3_1ebvbuu,Welcome Ultra Bugs,3,0.4588
t3_1ebvbuu,Bacteria:  “challenge accepted”,3,0.0
t3_1ebvbuu,Skeptical Senses tingling!,3,-0.3802
t3_1ebvbuu,Until that gets over prescribed and overused and microbes evolve to resist that too,5,0.0
t3_1ebvbuu,famous last words,6,0.0
t3_1ebvbuu,"Key word, virtually. 

This current generation of superbugs are likely done for, but nature always finds a way",2,0.0
t3_1ebvbuu,One can only hope that this is a hospital-use only drug that is given only in circumstances where someone has a serious infection that can't be treated with other drugs. There is no way something doesn't evolve to be resistant to this,2,0.1027
t3_1ebvbuu,"\"Hey, I've seen this one - this is classic!\"",2,0.0
t3_1ebvbuu,What a stupid post. Every new antibiotic is like that until they develop resistance to it,2,-0.2263
t3_1ebvbuu,We can ill afford another Klandathu...,2,-0.4215
t3_1ebvbuu,"Quick, use it for herds of cattle in low amounts!!",2,-0.3987
t3_1ebvbuu,I saw a movie about this.   Here comes the zombies,2,0.0
t3_1ebvbuu,... until it isn't,2,0.0
t3_1ebvbuu,Science is so fucking cool,2,0.4351
t3_1ebvbuu,Nature: hold my beer.,2,0.0
t3_1ebvbuu,Super Bacteria 2: Electric Bugaloo.,2,0.5994
t3_1ebvbuu,"We've heard this before. The stronger these things get, the more side effects.",2,0.3818
t3_1ebvbuu,"Soon \"Bacteria now getting resistant against resistance-proof antibiotic.\"",2,0.0
t3_1ebvbuu,"Great, it’ll be what $1300 a dose and not covered by most insurance?",2,0.6249
t3_1ebvbuu,I'd hate to be the one who finds out this isn't true.,2,-0.7212
t3_1ebvbuu,"Chaos Theory…. something, something…",2,-0.5719
t3_1ebvbuu,Ian Malcolm would love to add a perspective.,2,0.6369
t3_1ebvbuu,"Virtually. Not entirely. Goodbye superbugs, hello foxdie",2,0.0
t3_1ebvbuu,And zombies.  Thanks “super drug”.,2,0.4404
t3_1ebvbuu,"Funny.  I remember reading something similar in 1987, right before vancomycin resistant enterococcus happened.  And in 2000, right before carbapenem resistant klebsiella pneumoniae was talked about.",2,0.4404
t3_1ebvbuu,99% safe and effective don’t listen to conspiracy fools,2,-0.1531
t3_1ebvbuu,"Hold my beer.  
 -Bacteria, probably",2,0.0
t3_1ebvbuu,Mother Nature: “challenge fucking accepted”,2,0.0
t3_1ebvbuu,No. Stop. Don't test the bugs. They will adapt and they will win.,2,0.1027
t3_1ebvbuu,Actual good news?  Not sure that is allowed post 2015…,2,0.2354
t3_1ebvbuu,Just this one strange side effect...,2,-0.2023
t3_1ebvbuu,Who wants to bet some big pharmaceutical company sues them for impacting their bug war profiteering?,2,-0.6705
t3_1ebvbuu,"*currently


So was penicillin",2,0.0
t3_1ebvbuu,Until it's not!,2,0.0
t3_1ebvbuu,"”Virtually resistance-proof\"...until it's not.",3,0.0
t3_1ebvbuu,Evolution be like: bet,2,0.3612
t3_1ebvbuu,Virtually means it isn't lol.,5,-0.3252
t3_1ebvbuu,"Evolution: \"Hold my beer!\"

COVID was just a warning shot, this author is tempting Murphey! Never temp Murphy!",2,-0.5067
